id	speaker	sex	text	text_en	power	orientation	populism
ua00037	a0d61a2908cabd60c83ab3bc4c9785f7	M	народний депутат України (багато-мандатний загальнодержавний виборчий округ, <PARTY>). <PARTY>. Шановний Володимире Михайловичу! Шановні колеги! Дуже приємно, що сьогодні, у вівторок, ми чуємо дуже тверезі думки щодо серйозності переговорів, щодо зустрічі представників шести фракцій і щодо того, що треба домовлятися. Мабуть, як аргумент на користь таких пропозицій і спрацював той проект постанови, який розданий у залі. <p> Так, дійсно, треба домовлятися. Хоча у відповідності з Регламентом проект постанови внесений і він підлягає розгляду в рамках того питання, яке ми зараз слухаємо, - обрання голів комітетів і їх перших заступників. Але, зважаючи на те, що ми завжди з великою повагою і шаною ставилися до всіх без винятку колег, які обрані українським народом до парламенту, я пропоную вам, Володимире Михайловичу, зібрати керівників фракцій, провести засідання Погоджувальної ради і домовитися про те, чи існують принципи, на яких ми можемо домовитися, а не просто оголошувати перерву, як прозвучала пропозиція, до вівторка. Тому що, якщо така пропозиція і буде проголосована, не виключено, що наступного вівторка ми прийдемо з такими ж серйозними пропозиціями, з якими прийшли сьогодні. <p> Або ми домовляємося і розуміємо, що ми можемо домовитись, або ми працюємо у повній відповідності з Регламентом та розглядаємо проект постанови, який поданий. Така думка нашої фракції.	Ukrainian national deputy (mandatory national constituency, <PARTY>). The faction of the Social Democratic Party of Ukraine (United States). Dear Volodymyr Mikhailovich! Dear colleagues! It is a pleasure to hear very sober thoughts about the seriousness of the negotiations, about the meeting of representatives of the six factions, and about what needs to be arranged. Perhaps, as an argument for such proposals, the draft decision that was given in the hall worked.  <p>  Yes, indeed, we have to make a deal. Although, according to the Rules, the draft decree has been introduced and is under consideration in the matter that we are now hearing, the election of committee heads and their first interlocutors. But given that we have always treated everyone with great respect and respect without exception the colleagues elected by the Ukrainian people to Parliament, I suggest you, Volodymyr Mikhailovich, gather the factions leaders, hold meetings of the Conciliation Council and agree on whether there are principles on which we can agree, rather than simply declare a recess, as the proposal said, on Tuesday. Because if this proposal is voted out, it is not excluded that the next Tuesday we will come up with the same serious proposals that we have come up with today.  <p>  Either we agree and understand that we can agree, or we work in full compliance with the Rules and consider the draft decree that has been given. That's what our faction thinks.	NA	0	NA
ua00038	2844c862862d05ab75abc20582c5afcb	M	"член Комітету Верховної Ради України з питань економічної політики, управління народним господарством, власності та інвестицій  . Блок ""Наша Україна"". Шановний Ігоре Олеговичу! Як ви можете пояснити той факт, що при зростанні валового внутрішнього продукту на 9,1 відсотка реальні податкові надходження зменшилися порівняно з 2000 роком на 4,6 відсотка? Це перше. <p> І друге. Яка частка тіньової економіки, за вашою оцінкою? І чому Міністерство фінансів намагається через підвищення акцизів у горілчаній промисловості України збільшити частку тіньової економіки? <p> Дякую."	Member of the Committee of the Supreme Council of Ukraine on Economic Policy, Management of National Economy, Property and Investment. It's our Ukraine block. Dear Igor Olegovich! How can you explain the fact that when gross domestic product rose by 9.1 percent, real tax revenues decreased by 4.6 percent compared to 2000? That's the first one.  <p>  And the second. What part of the shadow economy is your estimate? And why is the Ministry of Finance trying to increase excise duties in Ukraine's gorilla industry to increase the share of the shadow economy?  <p>  Thank you.	NA	1	NA
ua00039	72fd0553f7838f475043691ec4714a83	M	"Шановні колеги! Розглядаємий проект основних напрямів бюджетної політики на 003 рік загалом відповідає вимогам чинного законодавства і передбачає розмір дефіциту Державного бюджету, який не повинен перевищувати 0,5 відсотків валового внутрішнього продукту. Проти 1,7 відсотків в поточному році. <p> При цьому є намагання передбачити бездефіцитність загального фонду Державного бюджету на 2003 рік. <p> Враховуючи, що дефіцит бюджету є показник, який не може визначатися окремо без перегляду всіх його показників, на мою думку необхідно погодитися на те, що його має визначати Уряд, який відповідно до Конституції відповідає за складання проекту бюджету. <p> Склавши баланс ресурсів та необхідних витрат на 2003 рік розуміючи можливість покриття такого дефіциту. <p> Щодо зарахування надходжень до приватизації , то досвід останніх років показав нестабільність зазначеного джерела і не можливість через ряд об’єктивних та суб’єктивних причин виконання такого показника у обсягах передбачених законом про Державний бюджет. <p> Тому прив’язка його до розділу фінансування, а не до доходів бюджету є цілком доречною. <p> Досі залишається складною ситуація щодо відшкодування податку на додану вартість , заборгованість яка накопичувалася роками не може зникнути одночасно і ти позитивні поки що, на жал, незначні тенденції говорять про рішучість Уряду у вирішенні цього питання. Єдине, що необхідно це не зупинятися на досягнутому, тому що до всіх інших проблем 2003 року обов’язково додається погашення заборгованості по невідшкодованому податку на додану вартість. <p> Інше нагальне питання, яке необхідно вирішувати в поточному та наступному році - це розв’язання проблеми недоїмки. <p> В напрямах бюджетної політики урядом відзначається необхідність вжиття рішучих заходів щодо істотного зниження темпів зростання заборгованості платежів до бюджету. <p> Про те, чи не вживались рішучі дії раніше. В минулому році Верховною Радою України був прийнятий закон про списання та реструктуризацію відповідної недоїмки. Проте минув лише рік, і проблема залишилась на тому ж самому рівні, та і ці заходи, що запропоновані урядом, вимагають внесення змін до діючого законодавства, розробки відповідних механізмів та порядків. Проте, більшість з необхідність досі не подані на розгляд Верховної Ради України. <p> Інше питання, яке намагаються розв’язати різні уряди останніми роками, це питання скасування податкових пільг, що надаються за галузевою та професійною ознакою. На жаль, знову ми підходимо до цього питання тільки з одного боку, намагаючись тільки відмінити зазначені пільги, не розглядаючи питання відповідної підтримки галузей, в яких пропонується забрати пільги. Проте, як і в іншому випадку відповідні законопроекти так і не подані до Верховної Ради України. <p> Без вирішення вищенаведених заходів важко говорити про реальність бюджету як необхідної умови його збалансованості. <p> Окремо хотілось би зупинитись на положеннях пунктів, що стосуються міжбюджетних відносин. Питома вага видатків місцевих бюджетів у зведеному бюджеті прогнозується на рівне не менше 40 відсотків, тобто як у поточному році, і це є рівень, нижче якого ми не можемо опуститись. Однак, на мою думку, цьому документу бракує відсутності у відповідному розділі висвітлення питання формування таких специфічних бюджетів, як бюджет міста Києва та бюджет Автономної Республіки Крим. Я вважаю, що він має бути доповнений положенням наступного змісту: формування бюджету Автономної Республіки Крим, міста Києва та Севастополя в 2003 році відбувається з урахуванням закону про затвердження Конституції Автономної Республіки Крим, Закону України ""Про столицю України місто-герой Київ"" та закону, що визначає особливий статус міста Севастополя, що повністю відповідає вимогам статті 67 Бюджетного кодексу України. <p> Позитивною можна вважати пропозицію щодо запровадження поетапного переходу до здійснення ряду програм Державного бюджету шляхом надання субвенцій місцевим бюджетам. <p> Окрема хотілось би зупинитися на питанні проведення видатків у 2003 році по пільгах і компенсаціях громадянам. Документом декларується намагання уряду змінити діючу систему пільг на адресну грошову допомогу, виходячи з рівня доходів населення. <p> Але на сьогодні діє рішення Конституційного Суду щодо надання пільг та існує певний дефіцит коштів для проведення зазначених видатків у повному обсязі. А за прогнозними розрахунками для забезпечення у 2002 році надання пільг, компенсацій і гарантій відповідно до чинного законодавства у бюджетах усіх рівнів необхідно щорічно передбачати близько 20 мільярдів гривень. <p> Проте уряд досі не подав відповідні законопроекти на розгляд Верховної Ради України. <p> Щодо захищених статей. З урахуванням обговорення, яке відбулося у Бюджетному комітеті, вважаю за доцільне передбачити в Законі про Державний бюджет перелік захищених статей. <p> Підводячи підсумки, необхідно відмітити: зазначений документ є досить збалансований та виважений документ, проте він іноді спирається на певні припущення та умови, які уряду в стислі терміни необхідно виконати, перш за все це стосується підготовки та подання на розгляд Верховної Ради України відповідних проектів законів як щодо податкової політики, так і щодо питань надання пільг і субсидій. <p> Хочеться сподіватись, що за цей короткий час уряд спроможний реалізувати всі ці заходи. Дякую."	Dear colleagues! The draft budget policy guidelines for 003 are generally in line with the requirements of current legislation and provide for the size of the government budget deficit, which should not exceed 0.5 percent of the gross domestic product. Against 1.7 percent in the current year.  <p>  In doing so, there is an attempt to predict the inadequacy of the General Fund of the State Budget for 2003.  <p>  Given that the budget deficit is an indicator that cannot be determined separately without looking at all its indicators, I think it should be determined by the Government, which is responsible for the drafting of the budget under the Constitution.  <p>  Having balanced resources and the necessary expenditure for 2003, understanding the possibility of covering such a deficit.  <p>  With regard to privatization, the experience of recent years has shown that the source is unstable and that it is not possible for a number of objective and objective reasons to carry out such an indicator within the scope of the State Budget Act.  <p>  Therefore, it is appropriate to attach it to the finance section rather than to the budget’s income.  <p>  So far, it remains difficult to pay back the value added tax, the debt that has accumulated over the years cannot disappear simultaneously, and you're positive so far, unfortunately, slight trends are talking about the government's determination to resolve this issue. The only thing that needs to be done is that all other problems in 2003 need to be covered by the payment of unpaid taxes on added value.  <p>  Another urgent issue that needs to be addressed in the current and next year is the solution to the problem of malnutrition.  <p>  In the direction of fiscal policy, the government notes the need to take decisive measures to significantly reduce the rate of increase in the debt of payments to the budget.  <p>  Whether or not decisive action has been taken before. Last year, the Supreme Council of Ukraine passed a law on the cheating and restructuring of the property. But only a year went by, and the problem remained at the same level, and these measures proposed by the government required changes to existing legislation, the development of appropriate mechanisms and procedures. However, most of the need has not yet been considered by the Supreme Council of Ukraine.  <p>  Another issue that governments have been trying to resolve in recent years is the abolition of tax benefits provided on a business and professional basis. Regrettably, once again we approach this issue only on the one hand, trying only to eliminate the benefits noted, without considering the appropriate support of the areas where benefits are offered. However, as in other cases, the relevant bills have never been submitted to the Supreme Council of Ukraine.  <p>  Without addressing the above measures, it is difficult to talk about the reality of the budget as a necessary condition for its balance.  <p>  In particular, I would like to stop at the position of the points relating to inter-budget relations. The volume of local budget expenditure in the budget is projected to be at least 40 percent, that is, as in the current year, and this is a level that we cannot lower. However, in my opinion, this document lacks a lack of coverage in the relevant section of the development of specific budgets, such as the budget of Kiev and the budget of the Autonomous Republic of Crimea. I believe that it should be complemented by the following content: the formation of the budget of the Autonomous Republic of Crimea, the city of Kiev and Sevastopol in 2003 takes into account the law on the approval of the Constitution of the Autonomous Republic of Crimea, the law of Ukraine on the capital of the city of Kiev and the law defining the special status of the city of Sevastopol, which fully meets the requirements of article 67 of the Ukrainian Budget Code.  <p>  The proposal to introduce a step-by-step transition to a number of State Budget programmes by granting subsidies to local budgets can be considered positive.  <p>  Some would like to stop on the issue of spending in 2003 on benefits and compensation to citizens. The document declares an effort by the government to change the current aid system to address money from the income level of the population.  <p>  But to date, there is a decision by the Constitutional Court regarding the granting of benefits, and there is a certain deficit of funds to carry out the expenditure in full. And it is estimated that about 20 billion dollars per year are needed to provide aid, compensation and guarantees in accordance with current legislation in all levels of budgets in 2002.  <p>  However, the government has not yet passed the relevant bills for consideration by the Supreme Council of Ukraine.  <p>  When it comes to protected articles. In view of the discussion that took place on the Committee on Budgets, it is appropriate to provide for a list of protected articles in the State Budget Act.  <p>  In summary, it is important to note that the specified document is a fairly balanced and balanced document, but it sometimes relies on certain assumptions and conditions that the government must fulfil in strict terms, first of all, with regard to the preparation and submission of relevant draft laws for consideration by the Supreme Council of Ukraine, both on tax policy and on the issue of the granting of benefits and subsidies.  <p>  In this short period of time, it is hoped that the government will be able to implement all these measures. Thank you.	NA	0	NA
ua00040	56871d58af32eb528f8b752ebbf357dd	M	Шановні народні депутати, я також пропоную цю колізію, яка склалася, вирішити в сесійній залі. Тобто Погоджувальна рада запропонувала, але сесійна зала може внести певні корективи. Але для того, щоб ми були свідомі, за що ми голосуємо, ми повинні знати зміст, перелік тих 39-ти законопроектів, які вносяться фракціями. Тому можна зробити, скажемо, перерву і надрукувати, а можна попросити або доручити Голові Верховної Ради, щоб він прочитав, які додаткові документи вносяться до Верховної Ради. І тоді можна разом за це або проголосувати, або не голосувати, як визначиться сесійна зала. Але ставити на голосування, я вважаю, потрібно. Тільки таким чином можна розв’язати цю проблему.	Ladies and gentlemen, I also propose that this commission be decided in the session room. So the Conciliation Board has offered, but the session hall can make some adjustments. But in order for us to be aware of what we are voting for, we need to know the meaning of the list of the 39 bills that are being passed by the factions. So you could, say, take a break and print it, or you could ask the Head of the Supreme Council to read what additional documents are being submitted to the Supreme Council. And then you can either vote together for it or not vote on how the session room will be determined. But put to the vote, I think we should. Only in this way can this problem be solved.	NA	0	NA
ua00041	42e0c929785017932482f1d0311b9e43	M	"Червоній, фракція ""Наша Україна"". <p> Шановні колеги! Шановний Володимире Михайловичу! <p> Я, знаєте, у парламенті уже четверте скликання, але такої дивної процедури я ніколи не бачив, не зустрічав і не читав в Регламентах всіх цих скликань. Що означає ""винести за дужки""? Чи не означає це те, що ви, шановний Володимире Михайловичу, хочете у даному разі застосувати процедуру обрання суддів. Там, дійсно, виносяться за дужки ті судді, які викликають сумніви, заперечення, і потім їх голосують за те, щоб затвердити. В даному разі депутати пропонували зовсім іншу процедуру ту, яка закладена в Регламенті : ті питання порядку денного, які викликають сумнів, входять за основу і потім депутати голосують за їхнє вилучення із загального переліку порядку денного. І тому я прошу не пересмикувати пропозиції депутатів, а поставити на голосування саме в їхній пропозиції, в їхньому тлумаченні, а не і тому, що ви видали, Володимире Михайловичу. Дякую."	Red, faction of our Ukraine.  <p>  Dear colleagues! Dear Volodymyr Mikhailovich!  <p>  I've, you know, been in Parliament for the fourth time, but I've never seen, met or read all these calls in the Rules. What do you mean, take the parentheses? Does that not mean that you, Reverend Vladimir Mikhailovich, want to apply the procedure for the election of judges at this time? There, indeed, are those judges who raise doubts, deny them, and then vote them to approve. In this case, the MPs have proposed a completely different procedure to the one set out in the Rules: those issues of the agenda that raise doubts form the basis and then the MPs vote in favour of their removal from the general order of the day. And so I ask you not to cross-reference the proposals of the deputies, but to put them to the vote in their proposal, in their interpretation, and not because of what you have published, Volodymyr Mikhailovich. Thank you.	NA	1	NA
