id	speaker	sex	text	text_en	power	orientation	populism
ua00085	83ae953bc9f63f5540115d19a16b8f06	M	"Шановні колеги, мені доручено оголосити заяву фракції ""Нашої України"" у Верховній Раді. <p> На думку нашої фракції політична криза перейшла в Україні на якісно новий рівень. Влада навіть не проявила бажання вийти на діалог, практично збанкрутувавши перед суспільством, адже не тільки не змогла показати вихід з глухого кута, а навіть відкинула варіанти врегулювання ситуацій, які були їй запропоновані. Олігархізація, кланові верхівки набули галопуючих темпів після призначення лідера клану СДків керівником президентської адміністрації. Кланова влада абсолютно відірвана від суспільства, не підзвітна представницьким органам, для неї не писані закони. Маргінальна по своїй політичній природі, вона існує лише для самозбереження. <p> Фракція ""Наша Україна"" має послідовну позицію, виступаючи з ініціативою формування більшості і уряду народної довіри. ""Наша Україна"" - це політиччна сила, що представляє інтереси більше 6 мільйонів українських виборців. Останнє речення. <p> Тому ми зараз відповідально заявляємо свою позицію не брати участь у голосуваннях порядку денного сесії доти, доки Верховна Рада на своєму засіданні не розгляне політичну ситуацію в країні. Без такого розгляду подальшої нормалізації політичної ситуації прийняття будь-яких законодавчих актів буде, з нашої точки зору неможливим. <p> Голова фракції Віктор Ющенко підписав."	"Dear colleagues, I'm hereby authorized to announce the statement of the faction of ""<PARTY>"" in the Supreme Council.  <p>  According to our faction, the political crisis has changed to a qualitatively new level in Ukraine. The government did not even want to go into a dialogue, practically bankrupting society, for it was not only unable to show the way out of the deaf corner but even rejected the solutions to the situations that had been offered to it. The oligarchization, the clan’s peaks gained momentum after the appointment of the leader of the KFOR clan as head of the presidential administration. Clan's power has been completely cut off from society, not accountable to representative authorities, and there are no laws written for it. Marginal in its political nature, it exists only for self-preservation.  <p>  The ""<PARTY>"" faction has a consistent position, taking the initiative to form the majority and the government of national trust. ""<PARTY>"" is a political force representing the interests of more than 6 million Ukrainian voters. Last sentence. <p> That is why we are now responsibly expressing our position not to vote in the order of the day session until the Supreme Council at its meeting considers the political situation in the country. Without such consideration of the further normalization of the political situation, the adoption of any legislative acts will be impossible in our view.  <p>  Victor Yushchenko, head of the faction, signed."	NA	1	NA
ua00086	febdc2a8b2961f699fb01cb01ac1d9a2	M	"Уважаемый Владимир Михайлович, уважаемые народные депутаты. <p> Украина негодна могучая авиационная держава в день обретения независимости имела колоссальный авиационный потенциал: 4 авиационных завода, 15 мощнейших авиаремонтных предприятий, конструкторское бюро имени Антонова, конструкторское бюро авиационных двигателей ""Моторсіч"", 2 авиационных института, 3 высших военных авиационных училища, около 1500 воздушных судов гражданской авиации, более 6000 самолетов ВВС. Практически вся эта система работала. На сегодняшний день положение катастрофично. <p> Авиалинии ""Рух України"", это национальный авиаперевозчик страны, имеет в своем составе всего лишь 3 исправных самолета: два маленьких ""<PARTY>-134"" и один ""<PARTY>-154"". В транспортной авиации ВВС исправны единицы самолетов. Исправность боевой авиации резко падает вниз. Авиационные заводы, как и авиаремонтные практически не работают. <p> За годы независимости при потери около 80 процентов авиационного потенциала не удалось нормально внедрить ни одно новое авиационное изделие отечественного производства. Серия авиационных катастроф с огромными человеческими жертвами потрясла сознание граждан Украины и всего человечества. Это следствие глубокого кризиса в авиации страны. Кризис охватил военную и гражданскую авиацию, имея абсолютно одинаковые признаки и причины его породившие. К наиболее характерным причинам относится: резкое снижение качества подготовки авиационных специалистов, практически полное разрушение системы подготовки летных кадров в Украине. Несколько лет летные учебные заведения выпускают летчиков без летной практики, без единого часа налета. В боевых полках первая шеренга - это те летчики, которые самые опытные и наиболее опытные не умеют летать. Наблюдается старение летных кадров. Средний возраст летного состава на сегодняшний день превышает сорокалетний рубеж. Скажу по себе. Мне 41 год, я считаюсь молодым в авиации страны. Летчикам, пилотировавшим <PARTY>-27 в Скнилове было одному 49 лет, второму - 45. Это очень много для летчика-истребителя. <p> Критическое состояние парка воздушных судов. Более 80 процентов потеряли летную годность на сегодняшний день. Отсутствует реальная государственная программа модернизации, лизинга, замены этого парка современными самолетами и ветролетами. Та программа, которая принята, не выполняется, низкие темпы развития авиационной промышленности, недостаточный уровень конкрентноспособности продукции, отсутствие реальной поддержки со стороны государства, неуправляемый со стороны государства процесс построения украинского рынка авиационных работ, захват национальных достояний иностранными авиаперевозчиками. <PARTY>не низкий уровень исполнительной дисциплины среди высших руководителей авиации страны, резкое снижение уровня безопасности. <p> Анализ показывает, что за крайние, будем говорить, надеюсь, последние 10 лет, произошло двадцать тяжелейших авиационных катастроф, которые повлекли гибель более 400 человек. <p> Возникает вопрос:"" Почему это произошло и кому это выгодно?"" На этот вопрос в полной мере объективно сможет ответить только независимая от ведомственных интриг временная следственная комиссия Верховной Рады Украины, которую я и группа депутатов предлагают создать. Создание этой комиссии полностью соответствует статье 89 Конституции Украины, а также статье 8.4.4 Регламента Верховной Рады. <p> Основные направления комиссии - это безопасность авиации и, в первую очередь, безопасность всех пользователей воздушного пространства нашего государства. Использование законов Украины и нормативно-правовых актов по вопросам авиации руководителями исполнения высших рангов, персональной ответственности высших авиационных руководителей по защите национальных интересов развития авиации Украины и обороны государства. Адекватность действий руководителей авиационной власти Украины требованиям Президента Украины правительства Верховной Рады по вопросам интеграции Украины в Европейский союз и соответствии стандартам Международной организации гражданской авиации КАО. Законность и эффективность расходов из Государственного бюджета на развитие авиации Украины. <p> Таким образом, под контроль временной следственной комиссии Верховной Рады Украины по расследованию причин кризисного состояния в авиации Украины попадает деятельность всех органов исполнительной власти, предприятия, организации, которые занимаются разработкой, изготовлением, испытанием и сертификацией, лицензированием, эксплуатацией, ремонтом, модернизацией авиационной техники, вопросами обеспечения безопасности авиации, эффективности использования рынка авиационных работ. <p> Я прошу снять с голосования проект постановы 2111, так как 2111-д более полно соответствует реалиям и отработан практически со всеми главами фракций. И выражаю благодарность главам фракций и тем депутатам, которые поддержали нас в этом вопросе. Спасибо. <p> Спасибо."	"Dear Vladimir Mihajlovich, distinguished members of the people.  <p>  Ukraine had an unthinkable aviation power on the day of independence: 4 airlines, 15 largest aircraft repair companies, Antonov design bureau, Motorsic aircraft design office, 2 aviation institutes, 3 top military aviation schools, about 1,500 civil aircraft, over 6,000 military aircraft. It's practically all worked. To date, the situation is catastrophic.  <p>  The U.S. Air Force is a national air carrier with only three fixed-wing aircraft: two small <PARTY>-134 and one <PARTY>-154. Air Force units are correct in air operations. The correctness of combat aviation is falling sharply down. Aviation factories, like aircraft, are virtually out of service.  <p>  During the years of independence, about 80 per cent of aviation capacity was unable to properly implement any new aviation product of domestic production. The series of aviation catastrophes involving huge human casualties has shaken the awareness of Ukrainian citizens and of all mankind. This is a consequence of the deep crisis in the country's aviation. The crisis covered military and civil aviation with exactly the same signs and causes as its bearers. Among the most significant reasons are the sharp decline in the quality of aviation training, the almost complete destruction of the flight training system in Ukraine. For several years summer education institutions have issued pilots without flight practice, without a single hour of flight. In combat regiments, the first sheringa is the pilots who are the most experienced and experienced not to fly. There is an ageing of flight personnel. The average age of flight is now more than 40 years. I'll tell you what. I am 41 years old, and I consider myself young in aviation. The pilots flying the US 27 at Sknilov were 49 years old and the pilots were 45 years old. That's a lot for a fighter pilot.  <p>  Critical status of the fleet of aircraft. More than 80 per cent have lost their airworthiness to date. There is no real state programme for modernization, leasing, replacement of the park by modern aircraft and helicopters. This programme, which is not being adopted, is not being implemented, the low rate of development of the aviation industry, the lack of product competitiveness, the lack of real State support, the process of building the Ukrainian aviation market, the seizure of national assets by foreign air carriers. The very low level of executive discipline among the country's top aviation managers, the sharp decline in security.  <p>  The analysis shows that over the last 10 years, we will say, hopefully, that there have been twenty major aviation disasters that have led to the deaths of more than 400 people.  <p>  The question is: "" Why did this happen, and who benefits from it?"" This question will only be answered objectively by the interim commission of inquiry of the Supreme Council of Ukraine, which I and the group of deputies propose to establish. The establishment of this commission is in full conformity with article 89 of the Ukrainian Constitution, as well as with article 8.4.4 of the Rules of the Supreme Council.  <p>  The main areas of the Commission are aviation security and, above all, the security of all users of our State's airspace. The use of Ukrainian laws and legislation on aviation by top-ranking managers, the personal responsibility of senior aviation managers to protect the national interests of the development of Ukrainian aviation and the defence of the State. The adequacy of the actions of the Ukrainian aviation authorities to the requirements of the President of Ukraine of the Government of the Supreme Council on the integration of Ukraine into the European Union and compliance with the standards of the International Civil Aviation Organization of the CCA. Legality and effectiveness of the expenditure from the State budget for the development of Ukrainian aviation.  <p>  Thus, the interim investigation commission of the Supreme Council of Ukraine to investigate the causes of the crisis in aviation of Ukraine falls under the control of all the executive bodies, enterprises, organizations involved in the development, manufacture, testing and certification, licensing, operation, repair, modernization of aviation technology, aviation security, efficiency in the use of the aviation market.  <p>  I ask that draft regulation 2111 be removed from the vote, since 2111-d is more fully consistent with reality and worked with virtually all the heads of factions. And I thank the factions and those deputies who have supported us in this regard. Thank you. <p> Thank you."	NA	0	NA
ua00087	2cad522247382082887eaaee3c8d43da	F	секретар Комітету Верховної Ради України з питань Регламенту, депутатської етики та організації роботи Верховної Ради України  . Социалистическая партия Украины. Как член регламентного комитета, я вчера участвовала в проверке этих фактов. Действительно, есть документы, свидетельствующие о том, что депутаты, чьими карточками вчера голосовали, находятся в заграничных командировках и, кроме того, больны - есть справка соответствующая. <p> Далее. Сегодня сделал заявление Александр Петрович Барановский и аналогичное заявление в комитете есть от имени Рудьковского Николая Николаевича. Он сообщил о том, что в присутствии ряда депутатов   ему угрожал народный депутат Суркис. Я считаю, что соответствующее решение нужно принять комитету, который будет рассматривать эти вопросы. <p> Кроме того, фракция Социалистической партии Украины настаивает на рассмотрении на пленарном заседании вопроса о политической ситуации.	Secretary of the Committee of the Supreme Council of Ukraine on Rules, Deputy Ethics and Organization of Work of the Supreme Council of Ukraine. The <PARTY>. As a member of the regulatory committee, I participated in the verification of these facts yesterday. Indeed, there are documents that show that the deputies whose cards were voted on yesterday are on a foreign mission and that the sick have a certificate.  <p>  Next. Today, Alexander Petrovich Baranovsky made a statement and a similar statement in the committee is made on behalf of Rudekovsky Nikolaievich. He reported that in the presence of a number of deputies, he had been threatened by the Surkis People's Deputy. I believe that a decision should be taken by the Committee to deal with these issues.  <p>  In addition, the faction of the <PARTY> insists on the question of the political situation in plenary.	0	0	NA
ua00088	aadf5525d07fc55589e0e94f5e6bfab8	M	"голова підкомітету Комітету Верховної Ради України з питань паливно-енергетичного комплексу, ядерної політики та ядерної безпеки  . ""Наша Україна"". Шановні колеги! Вчора було оприлюднено звернення голови нашої фракції Віктора Ющенка. Ми не змінили свого рішення, і, як бачимо, наше рішення ігнорується. Більше того, вчора проводилися фіктивні голосування, але ми всі усвідомлюємо, що більшість у такій конфігурації не відбулася як така. Ми не повинні підміняти голосування фіктивними, і ми не допустимо нехтування наших конституційних прав. <p> Отже, зараз у парламенті серйозна криза, і з неї треба виходити цивілізовано. Якщо буде намагання нас переламати, то кількості голосів для такого перелому немає. Мені здається, треба відійти від цього і все-таки домовитися, коли ми розглянемо питання про політичну ситуацію в Україні."	"Head of the Committee of the Supreme Council of Ukraine on Fuel Energy, Nuclear Policy and Nuclear Security. ""<PARTY>."" Dear colleagues! Yesterday, the address of the head of our faction Victor Yushchenk was published. We have not changed our decision, and our decision is ignored. What's more, there was a fictitious vote yesterday, but we all realize that most of these configurations didn't happen as such. We should not replace the vote with a fictitious one, and we will not allow our constitutional rights to be ignored.  <p>  So there's a serious crisis in Parliament right now, and it needs to be civilized. If there is an attempt to break us, there is no number of votes for such a break. I think we need to move away from this and make a deal when we consider the political situation in Ukraine."	0	1	NA
ua00089	49e037a0414863a0b76276abdfb01ae3	M	"голова підкомітету Комітету Верховної Ради України з питань паливноенергетичного комплексу, ядерної політики та ядерної безпеки  . Фракція блоку Віктора Ющенка ""Наша Україна"", Український народний рух. Шановний пане Голово! Шановні народні депутати! Парламент проголосував про заслуховування сьогодні на Дні уряду питання інформації Кабінету Міністрів щодо реформування нафтогазового комплексу. <p> Не тільки народні депутати, а й вся Україна хоче почути сьогодні, а що саме вчора уряд підписав у Кишиневі? Я вважаю, що немає ніяких підстав, щоб сьогодні в порядку денному це питання випадало. <p> Якщо в когось є бажання в черговий раз приховати правду про те, що робиться у нас в державі, будь ласка, вносьте це до порядку денного і голосуйте про перенесення питання на листопад, на наступний рік чи в наступне тисячоліття. Тобто ми вимагаємо розгляду цього питання так, як це проголосував парламент. <p> Дякую."	"Head of the Committee of the Supreme Council of Ukraine on Fuel Energy, Nuclear Policy and Nuclear Security. The faction of Victor Yushchenka's block ""<PARTY>"", the Ukrainian People's Movement. Dear Mr. Head! Dear National Deputies! Parliament voted to hear today on the Government's Information Day of the Cabinet of Ministers on the reform of the oil and gas complex.  <p>  Not just the national MPs, but the whole of Ukraine wants to hear today, but what exactly did the government sign in Chisinau yesterday? I don't think there's any reason for this question to come out in the daytime.  <p>  If anyone wants to hide the truth once again about what is happening in our country, please put it in order of the day and vote to move the matter to November, to the following year or to the next millennium. That is, we demand that this issue be considered as voted by Parliament.  <p>  Thank you."	0	1	NA
